{
  "$schema": "https://json-schema.org/draft/2020-12/schema",
  "$id": "https://github.com/kkkrist/chromium-build-sources/blob/master/schema/feed-v1.schema.json",
  "title": "Chromium Build Sources Feed v1",
  "type": "object",
  "additionalProperties": false,
  "required": ["schemaVersion", "generatedAt", "sources", "builds"],
  "properties": {
    "schemaVersion": { "const": 1 },
    "generatedAt": { "$ref": "#/$defs/timestamp" },
    "sources": {
      "type": "array",
      "minItems": 1,
      "items": { "$ref": "#/$defs/source" }
    },
    "builds": {
      "type": "array",
      "minItems": 1,
      "items": { "$ref": "#/$defs/build" }
    }
  },
  "$defs": {
    "identifier": {
      "type": "string",
      "minLength": 1,
      "maxLength": 120,
      "pattern": "^[a-z0-9]+(?:[a-z0-9_-]*[a-z0-9])?$"
    },
    "label": {
      "type": "string",
      "minLength": 1,
      "maxLength": 120,
      "pattern": "^[^\\u0000-\\u001f\\u007f]+$"
    },
    "timestamp": {
      "type": "string",
      "format": "date-time",
      "pattern": "^\\d{4}-\\d{2}-\\d{2}T\\d{2}:\\d{2}:\\d{2}(?:\\.\\d{1,3})?Z$"
    },
    "httpsUrl": {
      "type": "string",
      "format": "uri",
      "maxLength": 2048,
      "pattern": "^https://"
    },
    "source": {
      "type": "object",
      "additionalProperties": false,
      "allOf": [
        {
          "if": { "properties": { "stale": { "const": true } } },
          "then": { "properties": { "error": { "type": "string" } } },
          "else": { "properties": { "error": { "type": "null" } } }
        }
      ],
      "required": ["id", "name", "repository", "checkedAt", "lastSuccessAt", "stale", "error"],
      "properties": {
        "id": { "$ref": "#/$defs/identifier" },
        "name": { "$ref": "#/$defs/label" },
        "repository": { "$ref": "#/$defs/httpsUrl" },
        "checkedAt": { "$ref": "#/$defs/timestamp" },
        "lastSuccessAt": { "$ref": "#/$defs/timestamp" },
        "stale": { "type": "boolean" },
        "error": {
          "oneOf": [
            { "type": "null" },
            { "type": "string", "minLength": 1, "maxLength": 500, "pattern": "^[^\\u0000-\\u001f\\u007f]+$" }
          ]
        }
      }
    },
    "capabilities": {
      "type": "object",
      "additionalProperties": false,
      "required": ["official", "proprietaryCodecs", "sync", "widevine"],
      "properties": {
        "official": { "type": "boolean" },
        "proprietaryCodecs": { "type": "boolean" },
        "sync": { "type": "boolean" },
        "widevine": { "type": "boolean" }
      }
    },
    "download": {
      "type": "object",
      "additionalProperties": false,
      "required": ["label", "name", "size", "url"],
      "properties": {
        "label": { "$ref": "#/$defs/label" },
        "name": { "$ref": "#/$defs/label" },
        "size": { "type": "integer", "minimum": 1 },
        "url": { "$ref": "#/$defs/httpsUrl" },
        "sha256": { "type": "string", "pattern": "^[a-f0-9]{64}$" }
      }
    },
    "build": {
      "type": "object",
      "additionalProperties": false,
      "required": ["id", "sourceId", "platform", "architecture", "tag", "channel", "version", "publishedAt", "releaseUrl", "capabilities", "downloads"],
      "properties": {
        "id": { "$ref": "#/$defs/identifier" },
        "sourceId": { "$ref": "#/$defs/identifier" },
        "platform": { "$ref": "#/$defs/identifier" },
        "architecture": { "$ref": "#/$defs/identifier" },
        "tag": { "$ref": "#/$defs/identifier" },
        "displayName": { "$ref": "#/$defs/label" },
        "channel": { "$ref": "#/$defs/identifier" },
        "version": { "type": "string", "pattern": "^\\d+\\.\\d+\\.\\d+\\.\\d+$" },
        "revision": { "type": "string", "pattern": "^\\d+$" },
        "publishedAt": { "$ref": "#/$defs/timestamp" },
        "releaseUrl": { "$ref": "#/$defs/httpsUrl" },
        "capabilities": { "$ref": "#/$defs/capabilities" },
        "downloads": {
          "type": "array",
          "minItems": 1,
          "items": { "$ref": "#/$defs/download" }
        }
      }
    }
  }
}
