{
  "builds": [
    {
      "architecture": "x64",
      "capabilities": {
        "official": true,
        "proprietaryCodecs": true,
        "sync": true,
        "widevine": true
      },
      "channel": "stable",
      "displayName": "Hibbiki – Stable – Sync – All Codecs+",
      "downloads": [
        {
          "label": "Archive",
          "name": "chrome.7z",
          "size": 429599976,
          "url": "https://github.com/Hibbiki/chromium-win64/releases/download/v150.0.7871.129-r1639810/chrome.7z"
        },
        {
          "label": "Installer",
          "name": "mini_installer.exe",
          "size": 117971968,
          "url": "https://github.com/Hibbiki/chromium-win64/releases/download/v150.0.7871.129-r1639810/mini_installer.exe"
        }
      ],
      "id": "hibbiki-chromium-win64-stable-codecs-sync",
      "platform": "win64",
      "publishedAt": "2026-07-17T15:16:38.000Z",
      "releaseUrl": "https://github.com/Hibbiki/chromium-win64/releases/tag/v150.0.7871.129-r1639810",
      "revision": "1639810",
      "sourceId": "hibbiki-chromium-win64",
      "tag": "hibbiki-stable-codecs-sync",
      "version": "150.0.7871.129"
    },
    {
      "architecture": "x64",
      "capabilities": {
        "official": false,
        "proprietaryCodecs": true,
        "sync": false,
        "widevine": true
      },
      "channel": "stable",
      "displayName": "Marmaduke – Stable – Ungoogled – All Codecs+",
      "downloads": [
        {
          "label": "Archive",
          "name": "ungoogled-chromium-150.0.7871.177-2_Win64.7z",
          "size": 144237714,
          "url": "https://github.com/macchrome/winchrome/releases/download/v150.7871.177-M150.0.7871.177-r1639810-Win64-2/ungoogled-chromium-150.0.7871.177-2_Win64.7z"
        },
        {
          "label": "Installer",
          "name": "150.0.7871.177-2_ungoogled_mini_installer.exe",
          "size": 136269312,
          "url": "https://github.com/macchrome/winchrome/releases/download/v150.7871.177-M150.0.7871.177-r1639810-Win64-2/150.0.7871.177-2_ungoogled_mini_installer.exe"
        }
      ],
      "id": "macchrome-winchrome-stable-ungoogled-codecs",
      "platform": "win64",
      "publishedAt": "2026-07-18T06:45:29.000Z",
      "releaseUrl": "https://github.com/macchrome/winchrome/releases/tag/v150.7871.177-M150.0.7871.177-r1639810-Win64-2",
      "revision": "1639810",
      "sourceId": "macchrome-winchrome",
      "tag": "marmaduke-stable-ungoogled-codecs",
      "version": "150.0.7871.177"
    },
    {
      "architecture": "x64",
      "capabilities": {
        "official": false,
        "proprietaryCodecs": true,
        "sync": false,
        "widevine": true
      },
      "channel": "stable",
      "displayName": "Marmaduke – Stable – Ungoogled – All Codecs",
      "downloads": [
        {
          "label": "Archive",
          "name": "Chromium.app.ungoogled-150.0.7871.92.tar.xz",
          "size": 146285632,
          "url": "https://github.com/macchrome/macstable/releases/download/v150.7871.92-M150.0.7871.92-r1639810-macOS/Chromium.app.ungoogled-150.0.7871.92.tar.xz"
        }
      ],
      "id": "macchrome-macstable-stable-ungoogled-codecs",
      "platform": "mac",
      "publishedAt": "2026-07-03T21:28:51.000Z",
      "releaseUrl": "https://github.com/macchrome/macstable/releases/tag/v150.7871.92-M150.0.7871.92-r1639810-macOS",
      "revision": "1639810",
      "sourceId": "macchrome-macstable",
      "tag": "marmaduke-stable-ungoogled-codecs",
      "version": "150.0.7871.92"
    },
    {
      "architecture": "x64",
      "capabilities": {
        "official": false,
        "proprietaryCodecs": true,
        "sync": false,
        "widevine": true
      },
      "channel": "stable",
      "displayName": "Marmaduke – Stable – Ungoogled – All Codecs",
      "downloads": [
        {
          "label": "Archive",
          "name": "ungoogled-chromium_150.0.7871.92_1.vaapi_linux.tar.xz",
          "size": 135916908,
          "url": "https://github.com/macchrome/linchrome/releases/download/v150.7871.92-M150.0.7871.92-r1639810-portable-ungoogled-Lin64/ungoogled-chromium_150.0.7871.92_1.vaapi_linux.tar.xz"
        }
      ],
      "id": "macchrome-linchrome-stable-ungoogled-codecs",
      "platform": "linux",
      "publishedAt": "2026-07-03T21:37:41.000Z",
      "releaseUrl": "https://github.com/macchrome/linchrome/releases/tag/v150.7871.92-M150.0.7871.92-r1639810-portable-ungoogled-Lin64",
      "revision": "1639810",
      "sourceId": "macchrome-linchrome",
      "tag": "marmaduke-stable-ungoogled-codecs",
      "version": "150.0.7871.92"
    },
    {
      "architecture": "x64",
      "capabilities": {
        "official": false,
        "proprietaryCodecs": false,
        "sync": false,
        "widevine": false
      },
      "channel": "snapshot",
      "displayName": "The Chromium Authors – Snapshot – x64",
      "downloads": [
        {
          "label": "Archive",
          "name": "chrome-win.zip",
          "size": 342025928,
          "url": "https://storage.googleapis.com/chromium-browser-snapshots/Win_x64/1666100/chrome-win.zip"
        },
        {
          "label": "Installer",
          "name": "mini_installer.exe",
          "size": 167733760,
          "url": "https://storage.googleapis.com/chromium-browser-snapshots/Win_x64/1666100/mini_installer.exe"
        }
      ],
      "id": "chromium-snapshot-win-x64-snapshot",
      "platform": "win64",
      "publishedAt": "2026-07-22T09:46:40.410Z",
      "releaseUrl": "https://storage.googleapis.com/chromium-browser-snapshots/?delimiter=%2F&prefix=Win_x64%2F1666100%2F",
      "revision": "1666100",
      "sourceId": "chromium-snapshot-win-x64",
      "tag": "chromium-authors-snapshot",
      "version": "152.0.7966.0"
    },
    {
      "architecture": "arm64",
      "capabilities": {
        "official": false,
        "proprietaryCodecs": false,
        "sync": false,
        "widevine": false
      },
      "channel": "snapshot",
      "displayName": "The Chromium Authors – Snapshot – ARM64",
      "downloads": [
        {
          "label": "Archive",
          "name": "chrome-win.zip",
          "size": 321075163,
          "url": "https://storage.googleapis.com/chromium-browser-snapshots/Win_Arm64/1666096/chrome-win.zip"
        },
        {
          "label": "Installer",
          "name": "mini_installer.exe",
          "size": 153174016,
          "url": "https://storage.googleapis.com/chromium-browser-snapshots/Win_Arm64/1666096/mini_installer.exe"
        }
      ],
      "id": "chromium-snapshot-win-arm64-snapshot",
      "platform": "winarm64",
      "publishedAt": "2026-07-22T09:46:32.097Z",
      "releaseUrl": "https://storage.googleapis.com/chromium-browser-snapshots/?delimiter=%2F&prefix=Win_Arm64%2F1666096%2F",
      "revision": "1666096",
      "sourceId": "chromium-snapshot-win-arm64",
      "tag": "chromium-authors-snapshot",
      "version": "152.0.7966.0"
    },
    {
      "architecture": "x64",
      "capabilities": {
        "official": false,
        "proprietaryCodecs": false,
        "sync": false,
        "widevine": false
      },
      "channel": "snapshot",
      "displayName": "The Chromium Authors – Snapshot – x64",
      "downloads": [
        {
          "label": "Archive",
          "name": "chrome-mac.zip",
          "size": 186068719,
          "url": "https://storage.googleapis.com/chromium-browser-snapshots/Mac/1666124/chrome-mac.zip"
        }
      ],
      "id": "chromium-snapshot-mac-snapshot",
      "platform": "mac",
      "publishedAt": "2026-07-22T10:00:56.382Z",
      "releaseUrl": "https://storage.googleapis.com/chromium-browser-snapshots/?delimiter=%2F&prefix=Mac%2F1666124%2F",
      "revision": "1666124",
      "sourceId": "chromium-snapshot-mac",
      "tag": "chromium-authors-snapshot",
      "version": "152.0.7966.0"
    },
    {
      "architecture": "arm64",
      "capabilities": {
        "official": false,
        "proprietaryCodecs": false,
        "sync": false,
        "widevine": false
      },
      "channel": "snapshot",
      "displayName": "The Chromium Authors – Snapshot – ARM64",
      "downloads": [
        {
          "label": "Archive",
          "name": "chrome-mac.zip",
          "size": 167749416,
          "url": "https://storage.googleapis.com/chromium-browser-snapshots/Mac_Arm/1666122/chrome-mac.zip"
        }
      ],
      "id": "chromium-snapshot-mac-arm-snapshot",
      "platform": "macarm64",
      "publishedAt": "2026-07-22T09:56:25.688Z",
      "releaseUrl": "https://storage.googleapis.com/chromium-browser-snapshots/?delimiter=%2F&prefix=Mac_Arm%2F1666122%2F",
      "revision": "1666122",
      "sourceId": "chromium-snapshot-mac-arm",
      "tag": "chromium-authors-snapshot",
      "version": "152.0.7966.0"
    },
    {
      "architecture": "x64",
      "capabilities": {
        "official": false,
        "proprietaryCodecs": false,
        "sync": false,
        "widevine": false
      },
      "channel": "snapshot",
      "displayName": "The Chromium Authors – Snapshot – x64",
      "downloads": [
        {
          "label": "Archive",
          "name": "chrome-linux.zip",
          "size": 238837923,
          "url": "https://storage.googleapis.com/chromium-browser-snapshots/Linux_x64/1666119/chrome-linux.zip"
        }
      ],
      "id": "chromium-snapshot-linux-x64-snapshot",
      "platform": "linux",
      "publishedAt": "2026-07-22T09:56:01.262Z",
      "releaseUrl": "https://storage.googleapis.com/chromium-browser-snapshots/?delimiter=%2F&prefix=Linux_x64%2F1666119%2F",
      "revision": "1666119",
      "sourceId": "chromium-snapshot-linux-x64",
      "tag": "chromium-authors-snapshot",
      "version": "152.0.7966.0"
    },
    {
      "architecture": "x64",
      "capabilities": {
        "official": false,
        "proprietaryCodecs": true,
        "sync": false,
        "widevine": true
      },
      "channel": "dev",